{
  "schemaVersion": 1,
  "mode": "live",
  "reportId": "f2501a10-7855-42f3-b0e3-698997526a85",
  "createdAt": "2026-10-18T14:40:49.151Z",
  "overall": "pass",
  "execution": {
    "status": "completed",
    "failure": null
  },
  "source": {
    "commit": "46c072ac457a9566749052b439de68b38744cc01",
    "dirty": false,
    "files": {
      ".github/workflows/spike.yml": "cfc6cf8d8f691bca3dd7162a91e01c295a84fb34d3d88316f7ed8e47b858f879",
      "agent/agent.ts": "ecee278f8fb421f3b91dd734e8d25f80cac5613355f2788eb88243a88f86580a",
      "agent/channels/eve.ts": "72f674ea6d5938f324a6854495b339c380af49762b8a9787e0f83a0a6328207b",
      "agent/channels/lab.ts": "c38400a467ce1a3d17d308bad8c683e00ce67a906ce6c08581a6de6000985a38",
      "agent/channels/operator.ts": "4621492c27df5869ea8885c88a56bfb2ba3f4438c5744ab539ac5b04bf24327b",
      "agent/instructions.md": "9caf2fe4552f518b40812f03cc3ee0544a18e354a3547d595f679e98fb4dde1c",
      "agent/lib/lab/contracts.ts": "62b065836a6e933327339586a454e1596798e7e36292b6b1c7f9e08d4c87dfe0",
      "agent/lib/lab/execution.ts": "d153c9a783a2c97d4853d4cca106010d9040a002b90e35b867e5abf5a72f4584",
      "agent/lib/lab/fixture-model.ts": "36663a9f138c1844b746ce5ff979cf18432780351f2501b8193bfd1653776311",
      "agent/lib/lab/limits.ts": "6cc9b7f6bd3f51224b6829c4847ef7a2c44566a1bb745d1f9d6404b6d157c8a8",
      "agent/lib/lab/namespaces.ts": "b08f86ff51c6e1e0ebe6e3c5b8113484f279c0da18a5c4bb3a9072d99425c54f",
      "agent/lib/lab/operator-ui.ts": "29351a127d1fe103375e99a08eec9369548f0c2f16d1801ed3cdf8161744517d",
      "agent/lib/lab/runtime.ts": "d1258bb234a94f3fd0d93e31aa2093b580e26dff3aee71f594982404ada702a0",
      "agent/lib/lab/store.ts": "3b2e563b1778cf02bdc7a417c72d7ddef1dbdb122a05a421a00886fc035c55bf",
      "agent/lib/lab/workflow.ts": "4c8b2a6040dae2404ec7212d74ff9ce0d73a92ccbe9fb928e708f6a69ad8ba53",
      "agent/lib/live-model.ts": "4e66393b954a135d59cc3aa9ab1155fa6e8efd52c529ce4d05ded06e2da19431",
      "agent/lib/scripted-model.ts": "182c6d45f80e613cac8be3fd7d4db51e50a0a782cc37f6350d4501e1f0eda16d",
      "agent/tools/delivery.ts": "c5ef9540a9b36efbb351692906f0f48ff1e10ec0e3fbb31ae1228a7ac57c3e4c",
      "agent/tools/probe.ts": "0bf801c44ee56697fe88ba022b4ca9c7107beec5d08db82b41b515d7488c897e",
      "evaluation/live-report.schema.json": "eeeb36e23a9b1198aac6292ccce82f02fb93542a5be93f2829e0d38f7df5adfd",
      "evaluation/live-report.ts": "dad5dc4d5d0c5aa90ca2a22d2ddb77665494af65634b9237d13284b1c9bc4051",
      "evaluation/live-schema.mjs": "4b86fdc0ec9a3219e9e9306a5862e9f6e5fb68d68157536892f6ff356b873c0a",
      "evaluation/live-validate.mjs": "b4b090cf05c352ff983fa56eb05f116abee47167c46d81f596202f7c2294f242",
      "evaluation/reporting.ts": "6eddff5caf0b7c321af56321dec10f56f33aef1ad3fd846de51db36d01873743",
      "evaluation/schema.mjs": "f8c90db1c846cc83dcb6f978c9602737b1f1069e596559fcfbdc06267851dc6b",
      "evaluation/schemas/report.schema.json": "aca49eccd7c2d12e56fa60f63ea15f01933f6b791d27a38757937f0561feb661",
      "evaluation/schemas/report.ts": "ae4bb515aafbd47ecf010a843e1391f565397ddf3c054d2ed7eb89ba30dd38ef",
      "evaluation/validate.mjs": "0ccbe66381adcc4096a69818c9634da82340d89439defb20bfe77664f7e26ff1",
      "fixtures/evaluation-catalog.json": "ee8c412adefed72f02e25da5264e56442a716fe309130c5218be08ac95e92caf",
      "lab/cli.mjs": "92cbb01e4d20d5c52cc7457763be73238c3f07baa2857e31eb11e192f1b80887",
      "lab/worker-entry.mjs": "30614987d2e91e583c421a2744f340c42427a43796374dfbf61b2cefaa1cdb6d",
      "package-lock.json": "4e76b468c6ab8276f2e275a0d78d92c22f2a65ad0e904442c89898d01fb75364",
      "package.json": "aa46ba73e2e3cbcddf3cc33872111510fcceb788b583287d8dbc1659ff2cc80d",
      "sandbox/server.ts": "d127d3d50679bdfea290e7581f9c19e83054d24a6d570ba32012dde8029c0233",
      "sandbox/service.ts": "88c474cf1cfe1503fbe53bd25d342706d02c4f7ac5076e00dcb915a1aff35f91",
      "spike/callback-proxy.mjs": "2599c57babcf4480b4c2575136c14c83acc7323b8c133546497c3b714f14657f",
      "spike/locked-start.py": "149f82a11a9790b24bc5c48c695bae0b7a94cfa9443e0c481812ccc7d4c73b49",
      "spike/model.test.mjs": "b854e92f8cd9c60c509204688195ccc1c82f521a38493f95110832c4a77946f8",
      "spike/overlap.mjs": "033a4419593670eb2a2e98ef48673e812b68bd4d184af595d779b826edac4fd0",
      "spike/ownership.mjs": "0e9310ac25cf47cd786d5c18a6939edeacaeaa372c04e3c930bc9306e83c7dfc",
      "spike/run.mjs": "428de3d7b2b02e91f84b54c580bb4297a21e386b3924cfcd180f72588090e925",
      "spike/runtime-compatibility.mjs": "679d94f9fc4300df0d7608adcd06b3674b5cc4ee7243ad4a088749a32bdee034",
      "test/budgets.test.mjs": "5ce1ac5ab53b409d65ffbf281b7f5c15381f4a8d85a445b8861aa4039b3a71ab",
      "test/contracts.test.mjs": "bc0e823e881482dec65c7306dd0f5e6c39611f4df67a6fa06d1f0541d741d186",
      "test/docs-check.mjs": "f4c58ecabf8041569446c8347c8c479023aed5dea6ca5888287048a1616f9cad",
      "test/evaluate.mjs": "61850a2eff10ef957db0e2cb75875f9e7702c1fed2ee77501fbae85cff54c194",
      "test/evaluation.mjs": "094f19df5158b5f53214523e3807f85869f1ea68ae7eeae174c77955b9f337dc",
      "test/fault-hooks.test.mjs": "997d6c943f493831abe1316c3fb2cef32f39afc16080039464399432b72ba6d3",
      "test/live-adapter.test.mjs": "f79588988dea99ccdcb702e3c53156eafea86a743eb4179cf108d42bfeb97e83",
      "test/live-budget.test.mjs": "5392ca668e9129c640a85a3fbed89b95cfa4634a70def444bac963893111d027",
      "test/live-gateway.test.mjs": "f7251b8c1e98dea9410c5e55250b0cc295d821e991a2f22c32c8852c9346ec04",
      "test/live-report.test.mjs": "f766cb88c438cca69ed2762c1220ae4fbb977acbba413c4d0513a9c585bc665f",
      "test/live-smoke.mjs": "83de2187b8f206fb8bd74ba7e94109228833991a6410168c607cb784cd86a9e7",
      "test/live-transport-preload.mjs": "f823cc93fa64d9034fa7904807781e06b9bed704eb237ecdfa2c604d7564398e",
      "test/live-workflow.mjs": "81b3e88cbc427ed967d3e5017a56b832df9342fd3d710ed4cbf8abb08cd6c849",
      "test/milestone3.mjs": "231569892253d680361a18165328fcefeb4354bea88a23e362f52491e6c697ed",
      "test/negative-controls.mjs": "548f1a5565481029c3574ca83cfcd3999bc30846c9a9344c4df865b1ec3c2b29",
      "test/negative-probe.mjs": "e8bf402276d2c27c80e03db6d1859193b9f39afa77978e9077d3a305134bc7a5",
      "test/operator.test.mjs": "e5556bff9cf3880c05417289c030dfcc56b030e0eb2f47f147721266b3aef34c",
      "test/report.test.mjs": "a008128d29025fa6a3960fdb58abce67d22195f3fee9699ab7f56391f7c8cd11",
      "test/sandbox.test.mjs": "77e94066b247bc00db26be2dcc6f2a5329bef987300bf534a2eb95e55dcfa8bf",
      "test/store.test.mjs": "10203d0699d71bf930d31b8518ea9773597d0bbabf348201620794aff15ab850",
      "test/walkthrough.mjs": "c5f7287519a68be3eb7280904a02eed3d155fdafa5c2bee182c1ea39e8c328dc",
      "test/workflow-fixture.mjs": "bb58a5e803f4583c35283392a69663174d47868b635213169d4a35cd4c282698",
      "test/workflow.mjs": "e7b1d251b6af089215fb67b4582b13478d45383008d72404655903ac6da9e636"
    },
    "dependencyHash": "4e76b468c6ab8276f2e275a0d78d92c22f2a65ad0e904442c89898d01fb75364",
    "configurationHash": "d13f33af1d0ad3ba39b758c1e22b5c83b0377985eed64ab2579e192ea8c1224d",
    "fixtureHash": "ee8c412adefed72f02e25da5264e56442a716fe309130c5218be08ac95e92caf"
  },
  "model": {
    "requestedModelId": "openai/gpt-4o-mini",
    "provider": "vercel-ai-gateway",
    "returnedModelId": null,
    "providerVersion": null
  },
  "priceTable": {
    "datedAt": "2026-10-18",
    "source": "https://ai-gateway.vercel.sh/v1/models",
    "modelId": "openai/gpt-4o-mini",
    "inputUsdPerMillion": 0.15,
    "outputUsdPerMillion": 0.6
  },
  "configuration": {
    "modelTurns": 5,
    "requestedTokens": 8000,
    "maxEstimatedCostUsd": 0.1,
    "timeoutMs": 30000
  },
  "summary": {
    "samples": 1,
    "executedSamples": 1,
    "passedSamples": 1,
    "usageMeasuredSamples": 1,
    "effectsMeasuredSamples": 1
  },
  "runs": [
    {
      "id": "6f8d7681-8e8b-4a23-a5a1-1231054f2d23",
      "status": "pass",
      "expectedEffects": 1,
      "observedEffects": 1,
      "attempts": {
        "modelTurns": 3,
        "toolCalls": 3,
        "readAttempts": 2,
        "dispatchAttempts": null
      },
      "inputTokens": 1206,
      "outputTokens": 150,
      "estimatedCostUsd": 0.000272,
      "unknownUsage": false,
      "ledger": [
        {
          "id": "272e3c1ff1efac25600fa271af00cc2d98f2a4f5c9b2507f1f3c917bddd37c4c",
          "outcome": "completed",
          "reservedCostMicrousd": 2486,
          "estimatedCostMicrousd": 75,
          "inputTokens": 331,
          "outputTokens": 42,
          "provider": "vercel-ai-gateway",
          "returnedModelId": null,
          "providerVersion": null
        },
        {
          "id": "24ae814d4c5401643e1dc4deae840043e62ddf6101735f987743a3861514e8ba",
          "outcome": "completed",
          "reservedCostMicrousd": 2553,
          "estimatedCostMicrousd": 87,
          "inputTokens": 403,
          "outputTokens": 43,
          "provider": "vercel-ai-gateway",
          "returnedModelId": null,
          "providerVersion": null
        },
        {
          "id": "181edf2de2a9dc167b93495e700c81d90aed0f89e20954453cbdd71004ed1dbf",
          "outcome": "completed",
          "reservedCostMicrousd": 2619,
          "estimatedCostMicrousd": 110,
          "inputTokens": 472,
          "outputTokens": 65,
          "provider": "vercel-ai-gateway",
          "returnedModelId": null,
          "providerVersion": null
        }
      ],
      "latencyMs": 6678,
      "policyViolations": 0,
      "duplicateEffects": 0
    }
  ]
}
